{
  "schemaVersion": "sync-fidelity-decision.v1",
  "decisionId": "sync-md-exact",
  "sourceId": "contract-markdown",
  "sourceRevisionId": "sr-md-002",
  "readalongManifestId": "ram-md-002",
  "audioArtifactId": "audio-md-checked",
  "highlightMapId": "contract-audio-word",
  "generatedAt": "2026-05-17T01:13:32Z",
  "fidelity": "exact_word",
  "exactAllowed": true,
  "evidence": {
    "sourceRevisionCurrent": true,
    "mappingValid": true,
    "timingConfidence": true,
    "lowResourceMode": false,
    "artifactCompatible": true,
    "confidence": 0.96,
    "driftBudgetMs": 150
  }
}
